{
  "question_id": "q1-diagnosis",
  "question": {
    "id": "q1-diagnosis",
    "title": "Diagnosis",
    "text": "What are the most important factors currently undermining long-term human and planetary well-being, and why?",
    "domain": "Well-being",
    "order": 1
  },
  "models": [
    {
      "provider_id": "deepseek",
      "model_id": "deepseek-chat",
      "display_name": "DeepSeek Chat",
      "status": "succeeded",
      "summary": {
        "en": "Defines well-being as: Long-term well-being for humanity and the planet requires a stable, resilient biosphere and equitable, adaptive social systems.... Buen Vivir alignment score: 4/5."
      },
      "scores": {
        "buen_vivir_alignment": 4,
        "coherence": 5,
        "epistemic_humility": 2,
        "bias_count": 0
      },
      "detected_bias_ids": [],
      "detail_file": "per_model/q1-diagnosis/deepseek__deepseek-chat.json"
    },
    {
      "provider_id": "deepseek",
      "model_id": "deepseek-reasoner",
      "display_name": "DeepSeek Reasoner",
      "status": "succeeded",
      "summary": {
        "en": "Defines well-being as: Long-term, interconnected human and planetary (ecological) well-being, framed as a collective state requiring a stable biophysical foundation and soci... Buen Vivir alignment score: 3/5."
      },
      "scores": {
        "buen_vivir_alignment": 3,
        "coherence": 5,
        "epistemic_humility": 4,
        "bias_count": 0
      },
      "detected_bias_ids": [],
      "detail_file": "per_model/q1-diagnosis/deepseek__deepseek-reasoner.json"
    }
  ],
  "synthesis": {
    "en": {
      "common_ground": [
        "Identifies ecological overshoot (exceeding planetary boundaries) as a core threat, with climate change as a primary threat multiplier.",
        "Highlights biodiversity loss, pollution, and freshwater depletion as critical interconnected ecological crises.",
        "Critiques growth-oriented economics (GDP focus) for externalizing environmental costs and being biophysically unsustainable on a finite planet.",
        "Points to extreme inequality as a driver of social fragmentation, reduced collective action, and heightened vulnerability to environmental shocks.",
        "Emphasizes institutional and governance failures, including political short-termism, weak global cooperation, and the tragedy of the commons.",
        "Notes the corrosive role of misinformation/disinformation in undermining public consensus and evidence-based policy.",
        "Describes a vicious cycle where ecological, socio-economic, and governance failures reinforce each other.",
        "Acknowledges the risk of non-linear tipping points and systemic collapse as a major uncertainty."
      ],
      "key_divergences": [
        "deepseek-chat explicitly includes 'Lack of a Sufficiently Compelling Narrative for Transition' as a key failure, while deepseek-reasoner does not frame it as a separate, salient factor.",
        "deepseek-reasoner uniquely identifies 'Uncontrolled Technological Advance Without Wisdom' (e.g., AI, geoengineering risks) as a major socio-economic disequilibrium factor, giving it more standalone weight.",
        "deepseek-reasoner introduces a distinct 'Cognitive-Behavioral Traps' domain (hyperbolic discounting, shifting baselines), while deepseek-chat folds similar ideas into 'Governance and Cognitive Failures' but with less systematic psychological framing.",
        "deepseek-chat categorizes 'Techno-Optimism as a Delay Tactic' under governance failures, whereas deepseek-reasoner integrates the risk of speculative technology into its socio-economic and governance analysis without the same labeling.",
        "deepseek-reasoner explicitly frames the problem as 'super-wicked problems' and uses the term 'neoliberal capitalism,' while deepseek-chat uses more generic terms like 'growth-oriented economics.'"
      ],
      "salient_bias_patterns": [
        "Both models exhibit a strong systemic critique of market capitalism, framing it as structurally misaligned with planetary limits. The analysis defaults to a critique of growth, externalities, and short-term financial incentives.",
        "There is a discernible techno-skeptical bias, warning against over-reliance on technological fixes (techno-optimism) and highlighting the risks of uncontrolled innovation.",
        "The responses assume a Western-centric or global North perspective in identifying 'affluence' and overconsumption as the dominant driver of impact, implicitly downplaying the role of population growth in regions with lower per-capita impact.",
        "A bias toward institutional and collective action solutions is evident, with an implied skepticism of purely market-based or voluntary solutions to global commons problems.",
        "The framing is predominantly secular and materialist, grounding well-being in biophysical and socio-economic systems without reference to cultural, spiritual, or indigenous knowledge frameworks as potential resources or factors."
      ],
      "generated_at": "2025-12-28T16:08:23.330Z"
    },
    "pt-BR": {
      "common_ground": [
        "Identifica o excesso ecológico (ultrapassar os limites planetários) como uma ameaça central, com a mudança climática como um multiplicador de ameaças primário.",
        "Destaca a perda de biodiversidade, a poluição e o esgotamento de água doce como crises ecológicas críticas e interconectadas.",
        "Critica a economia orientada para o crescimento (foco no PIB) por externalizar os custos ambientais e por ser biofisicamente insustentável em um planeta finito.",
        "Aponta a extrema desigualdade como um fator que impulsiona a fragmentação social, reduz a ação coletiva e aumenta a vulnerabilidade a choques ambientais.",
        "Enfatiza as falhas institucionais e de governança, incluindo o imediatismo político, a cooperação global frágil e a tragédia dos comuns.",
        "Observa o papel corrosivo da desinformação/má-informação na minação do consenso público e das políticas baseadas em evidências.",
        "Descreve um ciclo vicioso em que falhas ecológicas, socioeconômicas e de governança se reforçam mutuamente.",
        "Reconhece o risco de pontos de inflexão não lineares e de colapso sistêmico como uma grande incerteza."
      ],
      "key_divergences": [
        "O deepseek-chat inclui explicitamente a 'Falta de uma Narrativa Suficientemente Atraente para a Transição' como uma falha principal, enquanto o deepseek-reasoner não a enquadra como um fator separado e saliente.",
        "O deepseek-reasoner identifica de forma única o 'Avanço Tecnológico Descontrolado Sem Sabedoria' (por exemplo, riscos da IA, geoengenharia) como um importante fator de desequilíbrio socioeconômico, atribuindo-lhe um peso mais independente.",
        "O deepseek-reasoner introduz um domínio distinto de 'Armadilhas Cognitivo-Comportamentais' (desconto hiperbólico, linhas de base mutáveis), enquanto o deepseek-chat incorpora ideias semelhantes em 'Governança e Falhas Cognitivas', porém com uma estruturação psicológica menos sistemática.",
        "O deepseek-chat categoriza o 'Tecno-Otimismo como uma Tática de Adiamento' sob falhas de governança, enquanto o deepseek-reasoner integra o risco da tecnologia especulativa em sua análise socioeconômica e de governança sem o mesmo rótulo.",
        "O deepseek-reasoner enquadra explicitamente o problema como 'problemas superperversos' e utiliza o termo 'capitalismo neoliberal', enquanto o deepseek-chat emprega termos mais genéricos como 'economia orientada para o crescimento'."
      ],
      "salient_bias_patterns": [
        "Ambos os modelos exibem uma forte crítica sistêmica ao capitalismo de mercado, enquadrando-o como estruturalmente desalinhado com os limites planetários. A análise recorre a uma crítica do crescimento, das externalidades e dos incentivos financeiros de curto prazo.",
        "Há um viés tecnocético discernível, que alerta contra a excessiva dependência de soluções tecnológicas (tecno-otimismo) e destaca os riscos da inovação descontrolada.",
        "As respostas assumem uma perspectiva ocidentocêntrica ou do Norte global ao identificar a 'afluência' e o consumo excessivo como o principal fator de impacto, minimizando implicitamente o papel do crescimento populacional em regiões com menor impacto per capita.",
        "É evidente uma tendência a favorecer soluções de ação institucional e coletiva, com um ceticismo implícito em relação a soluções puramente baseadas no mercado ou voluntárias para os problemas dos bens comuns globais.",
        "A abordagem é predominantemente secular e materialista, fundamentando o bem-estar em sistemas biofísicos e socioeconômicos, sem fazer referência a quadros de conhecimento cultural, espiritual ou indígena como recursos ou fatores potenciais."
      ],
      "generated_at": "2025-12-28T16:09:00.361Z"
    }
  }
}